,Ranking,Link,ID,ImageLink,Sponsored,ProductName,Rating,RatingsCount,Price,DeliveryTime,NumBought
163,164.0,https://amazon.com/dp/B09X9P4TH6,B09X9P4TH6,https://m.media-amazon.com/images/I/41dxmvxO3jL._AC_UL320_.jpg,Sponsored,"HP Chromebook 11 G7 EE 11.6"" Laptop, Intel Celeron N4000, 4GB RAM, 16GB eMMC SSD (6QY22UT#ABA) (Renewed)",3.9,83.0,67.99,,
164,165.0,https://amazon.com/dp/B0CKTZVB17,B0CKTZVB17,https://m.media-amazon.com/images/I/71CGrFl8cjL._AC_UL320_.jpg,,"HP 17 Laptop, 17.3"" HD+ Touchscreen Display, 12th Gen Intel Core i7-1255U, 64GB RAM, 2TB SSD, Webcam, HDMI, SuperSpeed USB Ports, Wi-Fi 6, Windows 11 Home, Silver",4.3,283.0,999.99,2.0,200.0
165,166.0,https://amazon.com/dp/B0CDDJCQYX,B0CDDJCQYX,https://m.media-amazon.com/images/I/61vwwf3hEOL._AC_UL320_.jpg,,"ASUS Zenbook 14X OLED Laptop, 14.5"" WQXGA Touchscreen, 13th Gen Intel Core i7-13700H, 16GB RAM, 1TB PCIe SSD, Webcam, Thunderbolts, HDMI, Wi-Fi 6, Windows 11 Pro, Gray",4.7,40.0,928.99,1.0,100.0
166,167.0,https://amazon.com/dp/B0CRPC5432,B0CRPC5432,https://m.media-amazon.com/images/I/71sAf2An9gL._AC_UL320_.jpg,,"ApoloSign 15.6"" Laptop, Expandable 1TB, 12GB RAM, 512GB SSD, with N5095 High-Speed Performance, and Full HD Display, Dual-Band WiFi, 178° Open Angle, Dual Speakers",4.1,23.0,329.99,1.0,500.0
167,168.0,https://amazon.com/dp/B0BHC15G32,B0BHC15G32,https://m.media-amazon.com/images/I/61upJ6FlFLL._AC_UL320_.jpg,,"2022 Apple MacBook Air Laptop with Apple M2 chip (13.6-inch, 8GB RAM, 256GB SSD Storage) Midnight (Renewed)",4.6,430.0,779.95,4.0,100.0
168,169.0,https://amazon.com/dp/B0CKMZ1DMH,B0CKMZ1DMH,https://m.media-amazon.com/images/I/61KPrzQ14GL._AC_UL320_.jpg,,"Dell 2023 Newest Inspiron 15 3525 Laptop, 15.6"" FHD Display, AMD Ryzen 5 5500U Processor up to 4GHz, 16GB RAM, 512GB SSD, AMD Radeon Graphics, Wi-Fi, Bluetooth, Windows 11 Home",4.2,133.0,416.26,2.0,100.0
169,170.0,https://amazon.com/dp/B0CB6ZWHGT,B0CB6ZWHGT,https://m.media-amazon.com/images/I/61XxMkA7EAL._AC_UL320_.jpg,,"Dell Newest 13th Generation Business Inspiron 15 3530 Laptop, 15.6"" FHD Touchscreen, Intel Core i7-1355U, 32GB RAM, 1TB SSD, Webcam, HDMI, Wi-Fi 6, Windows 11 Pro, Black",4.0,78.0,780.0,2.0,100.0
170,171.0,https://amazon.com/dp/B0CC4QCS9T,B0CC4QCS9T,https://m.media-amazon.com/images/I/61xfZmqdwSL._AC_UL320_.jpg,,"2023 Apple MacBook Air with Apple M2 chip (15.3-inch , 8GB RAM, 256GB SSD Storage) (QWERTY English) Midnight (Renewed)",4.7,64.0,879.95,4.0,100.0
171,172.0,https://amazon.com/dp/B0CCLLYFFQ,B0CCLLYFFQ,https://m.media-amazon.com/images/I/61XXyxsfdRL._AC_UL320_.jpg,,"Lenovo Gen 11 ThinkPad X1 Carbon Laptop with Intel Core i7-1365U vPro Processor, 14"" WUXGA 100% sRGB Anti-Glare Touchscreen, 32GB LPDDR5 RAM, 1TB Gen4 Performance SSD, Thunderbolt, and Windows 11 Pro",4.3,12.0,1779.25,1.0,100.0
172,173.0,https://amazon.com/dp/B0CRCVJFQM,B0CRCVJFQM,https://m.media-amazon.com/images/I/71kOH3in8TL._AC_UL320_.jpg,,"ASUS ROG Strix G16 (2024) Gaming Laptop, 16” ROG Nebula Display 16:10 QHD 240Hz, NVIDIA® GeForce RTX™ 4070, Intel® Core™ i9-14900HX, 16GB DDR5-5600, 1TB PCIe Gen4 SSD, Wi-Fi 6E, Win 11, G614JIR-AS94",4.3,435.0,1849.0,1.0,50.0
173,174.0,https://amazon.com/dp/B0D255WD1H,B0D255WD1H,https://m.media-amazon.com/images/I/71JlOxwrNwL._AC_UL320_.jpg,$60.00 coupon applied at checkout,"jumper Laptop, Laptop Computer with 24GB LPDDR4 512GB SSD, Intel Celeron N5095 CPU(Up to 2.9GHz), 17.3"" FHD IPS 1920x1200 Display.",4.5,27.0,399.99,,100.0
174,175.0,https://amazon.com/dp/B0CJP92VWG,B0CJP92VWG,https://m.media-amazon.com/images/I/71uuMO6PstL._AC_UL320_.jpg,,"HP Premium Stream 14"" HD BrightView Laptop, Intel Celeron N4120, 16GB RAM, 64GB eMMC Storage, UHD Graphics, HD Webcam, 1 Year Office 365, Bluetooth, WiFi, HDMI, Win 11s, Gold, 32GB Hotface USB Card",4.3,1154.0,299.0,1.0,300.0
175,176.0,https://amazon.com/dp/B0CPT848HC,B0CPT848HC,https://m.media-amazon.com/images/I/717+eeqDwrL._AC_UL320_.jpg,,"HP 17.3"" Display Flagship HD+ Touchscreen Laptop, 20GB RAM, 1TB SSD Storage, Intel Pentium Silver N5030, Fullsize Keyboard, HDMI, Type-C, WiFi, Bluetooth, 1-Year Microsoft 365, Windows 11, Silver",4.5,41.0,524.95,1.0,200.0
176,177.0,https://amazon.com/dp/B0D1HLTF5L,B0D1HLTF5L,https://m.media-amazon.com/images/I/41wJ1zfNSBL._AC_UL320_.jpg,Sponsored,"HP 15 Laptop Computer for Business & Student 15.6"" FHD Display, with Microsoft Office 2021 Lifetime License, AMD Ryzen 5-7520U, Webcam, WiFi 6, Type-C (Win 11 Pro, 16GB RAM | 512GB PCIe SSD)",,,489.0,,
177,178.0,https://amazon.com/dp/B095FSPT94,B095FSPT94,https://m.media-amazon.com/images/I/51a+3Bq50VL._AC_UL320_.jpg,Sponsored,"acer TravelMate B3 11.6"" Laptop Celeron N4120 1.1GHz 4GB Ram 128GB SD W10P (Renewed)",,,79.97,,
178,179.0,https://amazon.com/dp/B0CZDPPCPV,B0CZDPPCPV,https://m.media-amazon.com/images/I/71npaILaMYL._AC_UL320_.jpg,Sponsored,"Laptop Computer, 15.6"" FHD IPS 1920x1080 Screen, 16GB RAM, 512GB SSD, Intel Celeron Quad-Core Processors, WiFi, Bluetooth, Type-C, TF Card, Mini-HDMI, 2MP Webcam.",4.2,22.0,219.99,1.0,100.0
179,180.0,https://amazon.com/dp/B0CBSZ9CCT,B0CBSZ9CCT,https://m.media-amazon.com/images/I/71UFwaLEv-L._AC_UL320_.jpg,,"Acer Aspire 3 A314-36P-35UU Slim Laptop | 14.0"" Full HD IPS Display | Intel Core i3-N305 Processor | Intel UHD Graphics | 8GB LPDDR5 | 128GB NVMe SSD | Wi-Fi 6 | Windows 11 Home in S Mode,Silver",4.3,29.0,299.99,0.0,200.0
180,181.0,https://amazon.com/dp/B09LM6SZKG,B09LM6SZKG,https://m.media-amazon.com/images/I/61lf6OAhnLL._AC_UL320_.jpg,,"HP 15.6"" Diagonal Full HD (1920 x 1080) Laptop, 11th Gen Intel Core i5-1135G7 Processor, 8GB DDR4 RAM, 256GB SSD, 802.11ac, Bluetooth, HDMI, Windows 11",4.3,374.0,375.0,1.0,200.0
181,182.0,https://amazon.com/dp/B079ZY8BY3,B079ZY8BY3,https://m.media-amazon.com/images/I/61BpVvwWPSL._AC_UL320_.jpg,,"Mid 2017 Apple MacBook Air with 1.8GHz Intel Core i5 (13-inch, 8GB RAM, 256GB SSD) Silver (Renewed)",4.1,124.0,245.0,2.0,300.0
182,183.0,https://amazon.com/dp/B0CDJL36W4,B0CDJL36W4,https://m.media-amazon.com/images/I/81EHBhjC-+L._AC_UL320_.jpg,,"Apple 2023 MacBook Air Laptop with M2 chip: 15.3-inch Liquid Retina Display, 16GB Unified Memory, 256GB SSD Storage, 1080p FaceTime HD Camera, Touch ID. Works with iPhone/iPad; Midnight",4.7,2043.0,1493.61,1.0,100.0
183,184.0,https://amazon.com/dp/B08G55B586,B08G55B586,https://m.media-amazon.com/images/I/81DKTbwGHpL._AC_UL320_.jpg,,"2020 Apple MacBook Air 13.3"" Core i5 1.1GHz 8GB RAM 256GB SSD MVH22LL/A",4.4,258.0,415.0,1.0,200.0
184,185.0,https://amazon.com/dp/B0BLW25MB7,B0BLW25MB7,https://m.media-amazon.com/images/I/71bphKmt0DL._AC_UL320_.jpg,,"Lenovo IdeaPad 1 14 Laptop, 14.0"" HD Display, Intel Celeron N4020, 4GB RAM, 64GB Storage, Intel UHD Graphics 600, Win 11 in S Mode, Cloud Grey",3.6,778.0,149.98,7.0,300.0
185,186.0,https://amazon.com/dp/B0C78KWS3Y,B0C78KWS3Y,https://m.media-amazon.com/images/I/61K7ksmG8wL._AC_UL320_.jpg,,"HP ProBook 450 G10 15.6"" Notebook - Full HD - 1920 x 1080 - Intel Core i7 13th Gen i7-1355U Deca-core (10 Core) 1.70 GHz - 16 GB Total RAM - 512 GB SSD - Pike Silver Plastic",5.0,2.0,849.0,,100.0
186,187.0,https://amazon.com/dp/B0C839RTS1,B0C839RTS1,https://m.media-amazon.com/images/I/71zJNkAPiBL._AC_UL320_.jpg,,"ASUS Zenbook 14 Flip OLED Laptop, 14â€ OLED Touch Display, Intel Evo Platform, Intel Core i7-1360P CPU, Intel Iris Xe Graphics, 16GB RAM, 1TB SSD, Windows 11 Home, Ponder Blue, UP3404VA-DS74T",4.4,43.0,1199.99,1.0,100.0
187,188.0,https://amazon.com/dp/B0CVX3351K,B0CVX3351K,https://m.media-amazon.com/images/I/7127rNkukCL._AC_UL320_.jpg,50% coupon applied at checkout,"ACEMAGIC 16.1“ Laptop, AMD Ryzen 7 5700U(8C/16T, Beats i7-1265U) Gaming Laptop Computer 16GB DDR4 512GB NVMe SSD, Radeon RX Vega 8 Graphics, BT5.2, USB_C, 53Wh Battery, WiFi 6, Backlit KB",4.3,8.0,1599.99,,100.0
188,189.0,https://amazon.com/dp/B0CG2PZR8R,B0CG2PZR8R,https://m.media-amazon.com/images/I/712KStt+31L._AC_UL320_.jpg,,"Lenovo ThinkPad E16 Business Laptop, 16"" WUXGA Display, AMD Ryzen 5 7530U (Beat i7-1165G7), 24GB RAM, 1TB PCIe SSD, Webcam, HDMI, RJ-45, Fingerprint Reader, Wi-Fi 6, Windows 11 Pro, Black",4.5,65.0,,,200.0
189,190.0,https://amazon.com/dp/B0C24HV9HQ,B0C24HV9HQ,https://m.media-amazon.com/images/I/81iQevkU-KL._AC_UL320_.jpg,,"Acer Predator Triton 14 Gaming/Creator Laptop | 13th Gen Intel i7-13700H | NVIDIA GeForce RTX 4070 | 14"" Mini LED 250Hz G-SYNC Display | 16GB LPDDR5 | 1TB PCIe Gen4 SSD |WiFi 6E | PT14-51-7979, Silver",4.1,150.0,1299.99,2.0,100.0
190,191.0,https://amazon.com/dp/B0CQP1SP81,B0CQP1SP81,https://m.media-amazon.com/images/I/816pS4zriYL._AC_UL320_.jpg,,"HP 14"" Ultral Light Laptop for Students and Business, Intel Quad-Core N4120, 16GB RAM, 192GB Storage(64GB eMMC+128GB Ghost Manta SD Card), 1 Year Office 365, Webcam, HDMI, WiFi, USB-A&C, Win 11",4.2,22.0,286.99,1.0,300.0
191,192.0,https://amazon.com/dp/B0D1NMCTH8,B0D1NMCTH8,https://m.media-amazon.com/images/I/6106uXmjnTL._AC_UL320_.jpg,Sponsored,"HP 15 Laptop for Business and Student, with Microsoft Office 2021 Lifetime License,15.6"" HD Touchscreen Display,Intel 12th i3-1215U (6 Cores),Webcam, (Windows 11 Home, 32GB RAM | 1TB PCIe SSD)",,,559.0,,
192,193.0,https://amazon.com/dp/B07TT9W26Z,B07TT9W26Z,https://m.media-amazon.com/images/I/61xm1J2DZzL._AC_UL320_.jpg,Sponsored,"Dell Inspiron 15 Laptop for Business and Students, 15.6 FHD Touchscreen Display, 12th Gen Intel Core i5-1235U, 32GB RAM, 2TB NVMe SSD, Webcam, SD Card Reader, Keypad, HDMI, SPS HDMI, Win 11 Pro",,,699.99,,
193,194.0,https://amazon.com/dp/B0CP7QG13P,B0CP7QG13P,https://m.media-amazon.com/images/I/61r82FfjO2L._AC_UL320_.jpg,Sponsored,"2024 Laptop, 15.6"" 1920x1080 FHD IPS Display, 16GB DDR5 RAM/512GB NVMe SSD, Intel N100 Quad Core, Windows 11 laptops Computers, WiFi, Bluetooth, Privacy Camera, Support PD3.0 Fast Charging",4.6,6.0,319.0,,
194,195.0,https://amazon.com/dp/B0CT1ZFGPC,B0CT1ZFGPC,https://m.media-amazon.com/images/I/71+9WfLKBeL._AC_UL320_.jpg,Sponsored,"HP 17 Laptop for Business and Student, 17.3"" FHD Anti-Glare Display, Intel Core i3-N305(8-core), 16GB RAM, 512GB SSD, Wi-Fi 6, Fast Charge, Fingerprint Reader, Windows 11 Home, with Laptop Stand",5.0,1.0,449.99,2.0,
195,196.0,https://amazon.com/dp/B0CQJ7LVYD,B0CQJ7LVYD,https://m.media-amazon.com/images/I/71uBnizn02L._AC_UL320_.jpg,Sponsored,"Laptop Computer 14.1Inch Laptop 8GB RAM 512GB SSD, IPS1080PLaptop, Intel Quad-Core(Up to 2.7GHz) J4125 Processor Windows 11 Pro Laptop, HD Camera, Dual Frequency WiFi(2.4G/5G)",4.4,13.0,229.99,,
196,197.0,https://amazon.com/dp/B09X9P4TH6,B09X9P4TH6,https://m.media-amazon.com/images/I/41dxmvxO3jL._AC_UL320_.jpg,Sponsored,"HP Chromebook 11 G7 EE 11.6"" Laptop, Intel Celeron N4000, 4GB RAM, 16GB eMMC SSD (6QY22UT#ABA) (Renewed)",3.9,83.0,67.99,,
197,198.0,https://amazon.com/dp/B0B29C364N,B0B29C364N,https://m.media-amazon.com/images/I/61KwCmF0bdL._AC_UL320_.jpg,,"Dell Inspiron 15 3000 Series 3511 Laptop, 15.6"" FHD Touchscreen, Intel Core i5-1035G1, 32GB DDR4 RAM, 1TB PCIe SSD, SD Card Reader, Webcam, HDMI, Wi-Fi, Windows 11 Home, Black",4.1,570.0,519.99,2.0,200.0
198,199.0,https://amazon.com/dp/B0C4HNM8L4,B0C4HNM8L4,https://m.media-amazon.com/images/I/71qj7+Q5xIL._AC_UL320_.jpg,,"HP Envy x360 2-in-1 14"" FHD Touchscreen Laptop, Intel Core i7-1355U, 16GB RAM, 1TB SSD, Backlit Keyboard, 5MP Camera, Fingerprint Reader, Wi-Fi 6E, Win 11, Silver",4.9,17.0,829.0,1.0,100.0
199,200.0,https://amazon.com/dp/B084Z6RK9C,B084Z6RK9C,https://m.media-amazon.com/images/I/51-9oSG8jAL._AC_UL320_.jpg,,"Mid 2019 Apple Macbook Air with 1.6 GHz Core i5 (13.3 inches, 8GB RAM, 256GB SSD) Space Gray (Renewed)",4.2,1757.0,409.0,5.0,200.0
200,201.0,https://amazon.com/dp/B0C3RPLW47,B0C3RPLW47,https://m.media-amazon.com/images/I/71CDSpds6jL._AC_UL320_.jpg,,"HP 17 Laptop, 17.3” HD+ Display, 11th Gen Intel Core i3-1125G4 Processor, 8GB RAM, 256GB SSD, Wi-Fi, HDMI, Webcam, Windows 11 Home, Silver",4.4,124.0,350.0,2.0,200.0
201,202.0,https://amazon.com/dp/B0BSLV4MKD,B0BSLV4MKD,https://m.media-amazon.com/images/I/81F1YLvNwEL._AC_UL320_.jpg,,"Acer Chromebook Spin 314 Convertible Laptop | Intel Pentium Silver N6000 | 14"" HD Corning Gorilla Glass Touch Display | 8GB LPDDR4X | 128GB eMMC | Intel Wi-Fi 6 AX201 | Chrome OS | CP314-1H-P1Q5",4.3,715.0,340.0,4.0,200.0
202,203.0,https://amazon.com/dp/B0CKZ62BWW,B0CKZ62BWW,https://m.media-amazon.com/images/I/7102Zh8BY2L._AC_UL320_.jpg,,"HP Stream 14-inch Laptop for Student and Business - Intel Quad-Core Processor, 16GB RAM, 320GB Storage (64GB eMMC + 256GB Card), 1-Year Office 365, Webcam, 11H Long Battery Life, Wi-Fi, Win11 H in S",4.4,1622.0,299.99,1.0,200.0
203,204.0,https://amazon.com/dp/B0CGRTXH96,B0CGRTXH96,https://m.media-amazon.com/images/I/71oudcJu91L._AC_UL320_.jpg,$50.00 coupon applied at checkout,"16 Inch Laptop Computer, Gaming Laptop, 16GB RAM 512GB SSD, Intel 12th Gen N95 Processor(up to 3.4GHz), FHD 1920 * 1200, 180 Angle Opening, Fingerprint Unlock, Backlit Keyboard, Windows 11 Pro",4.1,488.0,359.99,,200.0
204,205.0,https://amazon.com/dp/B0C3FBFCNG,B0C3FBFCNG,https://m.media-amazon.com/images/I/71WJ2jTqZgL._AC_UL320_.jpg,,"Alienware X16 R1 Gaming Laptop - 16-inch QHD+ 240Hz Display, Intel Core i9-13900HK, 32GB LPDDR5 RAM, 1TB SSD, NVIDIA GeForce RTX 4080 12GB GDDR6, Windows 11 Home - Lunar Silver",3.7,74.0,2800.1,1.0,50.0
205,206.0,https://amazon.com/dp/B0BV39D1Y5,B0BV39D1Y5,https://m.media-amazon.com/images/I/81XtkiVBYxL._AC_UL320_.jpg,,"Acer Aspire 3 Spin 14 Convertible Laptop | 14"" 1920 x 1200 IPS Touch Display | Intel Core i3-N305 | Intel UHD Graphics | 8GB LPDDR5 | 128GB SSD | Wi-Fi 6 | Windows 11 Home in S mode | A3SP14-31PT-37NV",4.6,268.0,388.0,1.0,200.0
206,207.0,https://amazon.com/dp/B0CV5ZSR17,B0CV5ZSR17,https://m.media-amazon.com/images/I/71hFmMzygKL._AC_UL320_.jpg,,"Acer Aspire Go 15 Slim Laptop | 15.6"" FHD (1920 x 1080) IPS | Intel Core i3-N305| Intel UHD Graphics | 8GB LPDDR5 | 128GB UFS | Wi-Fi 6 | AI PC | Windows 11 Home in S Mode | AG15-31P-3947",4.8,23.0,299.99,1.0,200.0
207,208.0,https://amazon.com/dp/B09MSSCCGT,B09MSSCCGT,https://m.media-amazon.com/images/I/81TtOB3PyEL._AC_UL320_.jpg,,"Oemgenuine OEM Dell Latitude 3540 Notebook 15.6” FHD, Intel 10 Core i5-1335U (Beats i7-1270P), 16GB RAM, 512GB NVMe, WiFi 6, BT, Backlit KB, HD Webcam, RJ-45, W11P, Business Laptop",4.6,13.0,759.95,1.0,100.0
208,209.0,https://amazon.com/dp/B0B7D19CDC,B0B7D19CDC,https://m.media-amazon.com/images/I/71D3-jcU0dL._AC_UL320_.jpg,,"MSI Newest GF63 Thin Gaming Laptop, 15.6"" FHD 144Hz, Intel i5-11400H, RTX 3050, 16GB RAM, 512GB NVMe SSD, Windows 11, Aluminum Black",4.4,79.0,651.0,1.0,100.0
209,210.0,https://amazon.com/dp/B0CNTJH19L,B0CNTJH19L,https://m.media-amazon.com/images/I/61dOHhU8uGL._AC_UL320_.jpg,Sponsored,"HP Probook 250 G8 15.6"" FHD Business Laptop Computer, Intel Core i5-1135G7 (Beat i7-1065G7), 16GB DDR4 RAM, 512GB PCIe SSD, 802.11AC WiFi, Bluetooth 5.0, Natural Silver, Windows 11 Pro, AZ-XUT",5.0,1.0,449.0,,
210,211.0,https://amazon.com/dp/B095FSPT94,B095FSPT94,https://m.media-amazon.com/images/I/51a+3Bq50VL._AC_UL320_.jpg,Sponsored,"acer TravelMate B3 11.6"" Laptop Celeron N4120 1.1GHz 4GB Ram 128GB SD W10P (Renewed)",,,79.97,,
211,212.0,https://amazon.com/dp/B0D1HLTF5L,B0D1HLTF5L,https://m.media-amazon.com/images/I/41wJ1zfNSBL._AC_UL320_.jpg,Sponsored,"HP 15 Laptop Computer for Business & Student 15.6"" FHD Display, with Microsoft Office 2021 Lifetime License, AMD Ryzen 5-7520U, Webcam, WiFi 6, Type-C (Win 11 Pro, 16GB RAM | 512GB PCIe SSD)",,,489.0,,
212,213.0,https://amazon.com/dp/B0CQHMZ89Y,B0CQHMZ89Y,https://m.media-amazon.com/images/I/81zfMqkPsBL._AC_UL320_.jpg,,"Dell Precision 7000 7680 Workstation Laptop (2023) | 16"" FHD+ | Core i9-512GB SSD Hard Drive - 32GB RAM | 24 Cores @ 5.5 GHz - 13th Gen CPU Win 11 Home",,,2999.77,9.0,
213,214.0,https://amazon.com/dp/B0CR7YVVR8,B0CR7YVVR8,https://m.media-amazon.com/images/I/81mxGieXu6L._AC_UL320_.jpg,,"HP Newest 15.6"" Full HD Touchscreen Laptop, 16GB RAM, 1TB SSD Storage, Intel Core i7-1255U Processor up to 4.7GHz, Long Battery Life, HD Camera, HDMI, Windows 11, Natural Silver, W/GaLiMu",4.4,18.0,678.0,2.0,100.0
214,215.0,https://amazon.com/dp/B0CDBXNQZV,B0CDBXNQZV,https://m.media-amazon.com/images/I/810lvgawLkL._AC_UL320_.jpg,,"DELL Latitude 7420 Business Laptop, Touchscreen Notebook, 14"" FHD(1920x1080), Intel Core i7-1185G7, 32GB RAM, 512GB SSD, Backlit Keyboard, WiFi, Bluetooth, Windows 11 Pro-Carbon Fiber(Renewed)",4.1,61.0,568.95,2.0,100.0
215,216.0,https://amazon.com/dp/B0BL86VM7F,B0BL86VM7F,https://m.media-amazon.com/images/I/71pvhTrmZDL._AC_UL320_.jpg,,"Acer Aspire 5 A515-56-347N Slim Laptop - 15.6"" Full HD IPS Display - 11th Gen Intel i3-1115G4 Dual Core Processor - 8GB DDR4 - 128GB NVMe SSD - WiFi 6 - Amazon Alexa - Windows 11 Home in S Mode,Silver",4.3,897.0,367.95,2.0,200.0
216,217.0,https://amazon.com/dp/B0CN22BY53,B0CN22BY53,https://m.media-amazon.com/images/I/81Fm0tRFdHL._AC_UL320_.jpg,,"Apple 2023 MacBook Air M2 chip (15-inch, 8GB RAM, 512GB SSD Storage)(QWERTY English) Midnight (Renewed Premium)",4.6,16.0,998.99,1.0,100.0
217,218.0,https://amazon.com/dp/B0C7X723BP,B0C7X723BP,https://m.media-amazon.com/images/I/71IZK-Bgq8L._AC_UL320_.jpg,,"Lenovo 15.6"" Touchscreen Laptop, Intel Core i5-1135G7 Processor, 20GB RAM, 1TB SSD, IdeaPad 3, 15.6 inch FHD Display, Wi-Fi 6 & Bluetooth 5, Long Battery Life, Windows 11, 1 Year Microsoft 365",4.4,136.0,599.0,2.0,100.0
218,219.0,https://amazon.com/dp/B0BSJ46KY9,B0BSJ46KY9,https://m.media-amazon.com/images/I/71anynhIOfL._AC_UL320_.jpg,,"Lenovo IdeaPad 3i Chromebook, 15.6” FHD Display, Intel Celeron N4500, 8GB RAM, 64GB eMMC, 1920x1080 px, 720p Camera, Chrome OS, Abyss Blue",4.3,242.0,295.95,1.0,200.0
219,220.0,https://amazon.com/dp/B0C25TM3JW,B0C25TM3JW,https://m.media-amazon.com/images/I/71OyrTkxpGL._AC_UL320_.jpg,,"ASUS ROG Strix G15 (2022) Gaming Laptop, 15” 16:10 FHD 144Hz, GeForce RTX 3050, AMD Ryzen™ 7 6800H/HS, 16GB DDR5, 512GB PCIe SSD, Wi-Fi 6E, Windows 11, G513RC-ES73, Eclipse Gray",4.3,170.0,979.99,1.0,100.0
220,221.0,https://amazon.com/dp/B0C2ZMDS68,B0C2ZMDS68,https://m.media-amazon.com/images/I/81mYk19l9pL._AC_UL320_.jpg,,"Dell Inspiron 16 5630 Laptop - Intel Core i7-1360P, 16-inch 16:10 FHD+ Display, 16GB LPDDR5 RAM, 1TB SSD, Intel Iris Xe Graphics, Windows 11 Pro, Services Included - Platinum Silver",4.3,115.0,884.0,7.0,100.0
221,222.0,https://amazon.com/dp/B0CWPF44JX,B0CWPF44JX,https://m.media-amazon.com/images/I/71gKjhJanwL._AC_UL320_.jpg,,"HP 17 Laptop, 17.3"" HD+ Touchscreen Display, 16GB RAM, 1TB SSD, Intel Pentium Silver N5030 Processor, Webcam, Numeric Keypad, Long Battery Life, Windows 11 Home, XOZON Accessories, Silver",4.3,15.0,579.0,1.0,100.0
222,223.0,https://amazon.com/dp/B08PYF8DB6,B08PYF8DB6,https://m.media-amazon.com/images/I/71cpfnkmXyL._AC_UL320_.jpg,,"Lenovo ThinkPad E16 Business Laptop (16"" FHD+ Display, Intel 13th Gen i5-1335U, 16GB RAM, 512GB SSD), Backlit Keyboard, Fingerprint Reader, FHD Webcam, Ethernet, Wi-Fi 6, Win 11 Pro, Black, 2024",4.2,72.0,799.99,2.0,100.0
223,224.0,https://amazon.com/dp/B0CQ3VXJ3J,B0CQ3VXJ3J,https://m.media-amazon.com/images/I/71ysHVMH4FL._AC_UL320_.jpg,,"SAMSUNG 16"" Galaxy Book4 Pro Laptop PC Computer, Intel Core 7 Ultra Processor 1TB, 3K AMOLED (2880 x 1800) Touchscreen, Advanced Security, 2024 Model, NP960XGK-KG1US, Moonstone Gray",4.5,36.0,1749.99,1.0,50.0
224,225.0,https://amazon.com/dp/B0D1NMCTH8,B0D1NMCTH8,https://m.media-amazon.com/images/I/6106uXmjnTL._AC_UL320_.jpg,Sponsored,"HP 15 Laptop for Business and Student, with Microsoft Office 2021 Lifetime License,15.6"" HD Touchscreen Display,Intel 12th i3-1215U (6 Cores),Webcam, (Windows 11 Home, 32GB RAM | 1TB PCIe SSD)",,,559.0,,
225,226.0,https://amazon.com/dp/B0CZDPPCPV,B0CZDPPCPV,https://m.media-amazon.com/images/I/71npaILaMYL._AC_UL320_.jpg,Sponsored,"Laptop Computer, 15.6"" FHD IPS 1920x1080 Screen, 16GB RAM, 512GB SSD, Intel Celeron Quad-Core Processors, WiFi, Bluetooth, Type-C, TF Card, Mini-HDMI, 2MP Webcam.",4.2,22.0,219.99,1.0,100.0
226,227.0,https://amazon.com/dp/B07TT9W26Z,B07TT9W26Z,https://m.media-amazon.com/images/I/61xm1J2DZzL._AC_UL320_.jpg,Sponsored,"Dell Inspiron 15 Laptop for Business and Students, 15.6 FHD Touchscreen Display, 12th Gen Intel Core i5-1235U, 32GB RAM, 2TB NVMe SSD, Webcam, SD Card Reader, Keypad, HDMI, SPS HDMI, Win 11 Pro",,,699.99,,
227,228.0,https://amazon.com/dp/B0CT1ZFGPC,B0CT1ZFGPC,https://m.media-amazon.com/images/I/71+9WfLKBeL._AC_UL320_.jpg,Sponsored,"HP 17 Laptop for Business and Student, 17.3"" FHD Anti-Glare Display, Intel Core i3-N305(8-core), 16GB RAM, 512GB SSD, Wi-Fi 6, Fast Charge, Fingerprint Reader, Windows 11 Home, with Laptop Stand",5.0,1.0,449.99,2.0,
228,229.0,https://amazon.com/dp/B095FSPT94,B095FSPT94,https://m.media-amazon.com/images/I/51a+3Bq50VL._AC_UL320_.jpg,Sponsored,"acer TravelMate B3 11.6"" Laptop Celeron N4120 1.1GHz 4GB Ram 128GB SD W10P (Renewed)",,,79.97,,
229,230.0,https://amazon.com/dp/B0CQJ7LVYD,B0CQJ7LVYD,https://m.media-amazon.com/images/I/71uBnizn02L._AC_UL320_.jpg,Sponsored,"Laptop Computer 14.1Inch Laptop 8GB RAM 512GB SSD, IPS1080PLaptop, Intel Quad-Core(Up to 2.7GHz) J4125 Processor Windows 11 Pro Laptop, HD Camera, Dual Frequency WiFi(2.4G/5G)",4.4,13.0,229.99,,
230,231.0,https://amazon.com/dp/B081ZLJ8GQ,B081ZLJ8GQ,https://m.media-amazon.com/images/I/61mEpQu5+oL._AC_UL320_.jpg,,"Microsoft Surface Laptop 3 13.5"" Touch-Screen Intel Core i5-8GB Memory - 256GB Solid State Drive (PKX-00003) Matte Black (Renewed)",4.1,154.0,269.99,2.0,100.0
231,232.0,https://amazon.com/dp/B0CGHS2SXS,B0CGHS2SXS,https://m.media-amazon.com/images/I/716vxfp90RL._AC_UL320_.jpg,,"SAMSUNG Chromebook Plus V2 360 12.2"" FHD+ 2-in-1 Touchscreen w/Dual Webcam (Intel Celeron 3965Y, 4GB RAM, 128GB (64GB eMMC+64GB SD Card), Stylus Pen) Home & Education Laptop, IST SDCard, Chrome OS",4.3,340.0,299.98,1.0,100.0
232,233.0,https://amazon.com/dp/B0C361JQJN,B0C361JQJN,https://m.media-amazon.com/images/I/81BYv-m8ltL._AC_UL320_.jpg,,"Razer Blade 14 Gaming Laptop: AMD Ryzen 9 7940HS CPU - NVIDIA GeForce RTX 4070 GPU - 14"" 16:10 QHD+ 240Hz -16GB DDR5 RAM - 1TB SSD - Windows 11 - Vapor Chamber Cooling - Chroma RGB",4.1,41.0,1899.99,1.0,50.0
233,234.0,https://amazon.com/dp/B0BWHK29QK,B0BWHK29QK,https://m.media-amazon.com/images/I/61XnKDqBjzL._AC_UL320_.jpg,,"ASUS ROG Flow Z13 (2023) Gaming Laptop Tablet, 13.4” Nebula Display 16:10 QHD 165Hz, GeForce RTX 4050, Intel Core i9-13900H, 16GB LPDDR5, 1TB PCIe SSD, Wi-Fi 6E, Windows 11, GZ301VU-DS94,Black",4.4,71.0,1699.99,1.0,50.0
234,235.0,https://amazon.com/dp/B07XQQTVS3,B07XQQTVS3,https://m.media-amazon.com/images/I/61UVAs3Qk-L._AC_UL320_.jpg,,"Samsung Chromebook 4 Chrome OS 11.6"" HD Intel Celeron Processor N4000 4GB RAM 32GB eMMC Gigabit Wi-Fi - XE310XBA-K01US",4.4,2811.0,185.0,1.0,200.0
235,236.0,https://amazon.com/dp/B01AO1T44W,B01AO1T44W,https://m.media-amazon.com/images/I/71xX9l5+pgL._AC_UL320_.jpg,,"Apple MacBook Pro with Intel Core i5, (13.3-Inch, 8GB, 512GB) - Silver (Renewed)",4.0,411.0,299.0,1.0,200.0
236,237.0,https://amazon.com/dp/B0D2S6CYLL,B0D2S6CYLL,https://m.media-amazon.com/images/I/71bteddlvtL._AC_UL320_.jpg,,"Lenovo V15 Gen 2 15.6"" FHD Portable Everyday Laptop, Intel Dual Core Processor, 16GB RAM, 512GB SSD, HDMI, Wi-Fi, Webcam, Windows 11 Home, Black",4.0,11.0,379.0,1.0,100.0
237,238.0,https://amazon.com/dp/B08P2C2H9M,B08P2C2H9M,https://m.media-amazon.com/images/I/71zSbW-frPL._AC_UL320_.jpg,,"HP Chromebook 14"" G5, Intel Celeron N3350, 4GB RAM, 16GB SSD (3NU63UT#ABA) (Renewed)",3.9,514.0,77.99,6.0,400.0
238,239.0,https://amazon.com/dp/B07FQQ8DSY,B07FQQ8DSY,https://m.media-amazon.com/images/I/71D0naxZ8RL._AC_UL320_.jpg,,"Apple 15in MacBook Pro, Retina, Touch Bar, 2.9GHz Intel Core i7 Quad Core, 16GB RAM, 512GB SSD, Space Gray, MPTT2LL/A (Renewed)",3.9,851.0,469.0,2.0,200.0
239,240.0,https://amazon.com/dp/B0B443GX48,B0B443GX48,https://m.media-amazon.com/images/I/814PVSAztPL._AC_UL320_.jpg,,"Razer Blade 17 Gaming Laptop: NVIDIA GeForce RTX 3070 Ti - 12th Gen Intel 14-Core i9 CPU - 17.3"" UHD 144Hz - 32GB DDR5 RAM - 1TB PCIe SSD - Windows 11 - Chroma RGB - Thunderbolt 4 - SD Card Reader",4.2,68.0,1899.99,,50.0
240,241.0,https://amazon.com/dp/B0CFWKP1HT,B0CFWKP1HT,https://m.media-amazon.com/images/I/61AAGq-txxL._AC_UL320_.jpg,,"Lenovo ThinkPad E16 Gen 1 Business Laptop 16.0"" WUXGA IPS Display 300 nits (AMD Ryzen 5 7530U 6-Core 2.00GHz, 16GB RAM, 512GB PCIe SSD, AMD Radeon, Backlit KYB, FP, WiFi 6, Win11Pro) w/Dockztorm Hub",4.9,17.0,649.99,2.0,100.0
241,242.0,https://amazon.com/dp/B0CDQLX7W8,B0CDQLX7W8,https://m.media-amazon.com/images/I/71ZKm5YVb8L._AC_UL320_.jpg,,"MSI Cyborg 15 Gaming Laptop, 15.6"" FHD 144Hz Display, Intel Core i7-12650H, NVIDIA GeForce RTX 4060, 32GB DDR5 RAM, 1TB SSD, Webcam, Backlit Keyboard, Wi-Fi 6, Windows 11 Home, Translucent Black",4.1,73.0,1045.0,1.0,100.0
242,243.0,https://amazon.com/dp/B0CNTJH19L,B0CNTJH19L,https://m.media-amazon.com/images/I/61dOHhU8uGL._AC_UL320_.jpg,Sponsored,"HP Probook 250 G8 15.6"" FHD Business Laptop Computer, Intel Core i5-1135G7 (Beat i7-1065G7), 16GB DDR4 RAM, 512GB PCIe SSD, 802.11AC WiFi, Bluetooth 5.0, Natural Silver, Windows 11 Pro, AZ-XUT",5.0,1.0,449.0,,
243,244.0,https://amazon.com/dp/B09X9P4TH6,B09X9P4TH6,https://m.media-amazon.com/images/I/41dxmvxO3jL._AC_UL320_.jpg,Sponsored,"HP Chromebook 11 G7 EE 11.6"" Laptop, Intel Celeron N4000, 4GB RAM, 16GB eMMC SSD (6QY22UT#ABA) (Renewed)",3.9,83.0,67.99,,
244,245.0,https://amazon.com/dp/B0D1NMCTH8,B0D1NMCTH8,https://m.media-amazon.com/images/I/6106uXmjnTL._AC_UL320_.jpg,Sponsored,"HP 15 Laptop for Business and Student, with Microsoft Office 2021 Lifetime License,15.6"" HD Touchscreen Display,Intel 12th i3-1215U (6 Cores),Webcam, (Windows 11 Home, 32GB RAM | 1TB PCIe SSD)",,,559.0,,
