,Ranking,Link,ID,ImageLink,Sponsored,ProductName,Rating,RatingsCount,Price,DeliveryTime,NumBought
0,1.0,https://amazon.com/dp/B0CT2NTKDC,B0CT2NTKDC,https://m.media-amazon.com/images/I/71+9WfLKBeL._AC_UL320_.jpg,Sponsored,"HP 17 Laptop for Business and Student, 17.3"" FHD Anti-Glare Display, Intel Core i3-N305(8-core), 16GB RAM, 1TB SSD, Wi-Fi 6, Fast Charge, Fingerprint Reader, Windows 11 Home, with Laptop Stand",5.0,1.0,499.99,,
1,2.0,https://amazon.com/dp/B0CZDPPCPV,B0CZDPPCPV,https://m.media-amazon.com/images/I/71npaILaMYL._AC_UL320_.jpg,Sponsored,"Laptop Computer, 15.6"" FHD IPS 1920x1080 Screen, 16GB RAM, 512GB SSD, Intel Celeron Quad-Core Processors, WiFi, Bluetooth, Type-C, TF Card, Mini-HDMI, 2MP Webcam.",4.2,22.0,219.99,1.0,100.0
2,3.0,https://amazon.com/dp/B0CQJ7LVYD,B0CQJ7LVYD,https://m.media-amazon.com/images/I/71uBnizn02L._AC_UL320_.jpg,Sponsored,"Laptop Computer 14.1Inch Laptop 8GB RAM 512GB SSD, IPS1080PLaptop, Intel Quad-Core(Up to 2.7GHz) J4125 Processor Windows 11 Pro Laptop, HD Camera, Dual Frequency WiFi(2.4G/5G)",4.4,13.0,229.99,,
3,4.0,https://amazon.com/dp/B0CM5JV26D,B0CM5JV26D,https://m.media-amazon.com/images/I/61RJn0ofUsL._AC_UL320_.jpg,,"Apple 2023 MacBook Pro Laptop M3 Pro chip with 11‑core CPU, 14‑core GPU: 14.2-inch Liquid Retina XDR Display, 18GB Unified Memory, 512GB SSD Storage. Works with iPhone/iPad; Space Black",4.7,288.0,1935.73,2.0,1000.0
4,5.0,https://amazon.com/dp/B0B3BVWJ6Y,B0B3BVWJ6Y,https://m.media-amazon.com/images/I/719C6bJv8jL._AC_UL320_.jpg,,"Apple 2022 MacBook Air Laptop with M2 chip: 13.6-inch Liquid Retina Display, 8GB RAM, 256GB SSD Storage, Backlit Keyboard, 1080p FaceTime HD Camera. Works with iPhone and iPad; Midnight",4.8,2501.0,829.0,1.0,3000.0
5,6.0,https://amazon.com/dp/B0CX23V2ZK,B0CX23V2ZK,https://m.media-amazon.com/images/I/71-D1xCuVwL._AC_UL320_.jpg,,"Apple 2024 MacBook Air 13-inch Laptop with M3 chip: 13.6-inch Liquid Retina Display, 8GB Unified Memory, 256GB SSD Storage, Backlit Keyboard, 1080p FaceTime HD Camera, Touch ID; Midnight",4.6,191.0,999.0,0.0,3000.0
6,7.0,https://amazon.com/dp/B0BS4BP8FB,B0BS4BP8FB,https://m.media-amazon.com/images/I/61gKkYQn6lL._AC_UL320_.jpg,,"Acer Aspire 3 A315-24P-R7VH Slim Laptop | 15.6"" Full HD IPS Display | AMD Ryzen 3 7320U Quad-Core Processor | AMD Radeon Graphics | 8GB LPDDR5 | 128GB NVMe SSD | Wi-Fi 6 | Windows 11 Home in S Mode",4.3,1976.0,299.99,1.0,4000.0
7,8.0,https://amazon.com/dp/B0CX23GFMJ,B0CX23GFMJ,https://m.media-amazon.com/images/I/71O14N5GYLL._AC_UL320_.jpg,,"Apple 2024 MacBook Air 15-inch Laptop with M3 chip: 15.3-inch Liquid Retina Display, 8GB Unified Memory, 256GB SSD Storage, Backlit Keyboard, 1080p FaceTime HD Camera, Touch ID; Midnight",4.6,128.0,1249.99,1.0,1000.0
8,9.0,https://amazon.com/dp/B0BZ8X9HGT,B0BZ8X9HGT,https://m.media-amazon.com/images/I/61oAh3XrX+L._AC_UL320_.jpg,,"HP Notebook Laptop, 15.6"" HD Touchscreen, Intel Core i3-1115G4 Processor, 32GB RAM, 1TB PCIe SSD, Webcam, Type-C, HDMI, SD Card Reader, Wi-Fi, Windows 11 Home, Silver",4.2,1077.0,453.98,2.0,2000.0
9,10.0,https://amazon.com/dp/B0C6NC4KRT,B0C6NC4KRT,https://m.media-amazon.com/images/I/61TGRBGTNzL._AC_UL320_.jpg,,"HP 17 Business Laptop, 17.3” HD+ Display, 11th Gen Intel Core i3-1125G4 Processor, 32GB RAM, 1TB SSD, Wi-Fi, HDMI, Webcam, Windows 11 Pro, Silver",4.3,686.0,496.0,2.0,1000.0
10,11.0,https://amazon.com/dp/B0CNTJH19L,B0CNTJH19L,https://m.media-amazon.com/images/I/61dOHhU8uGL._AC_UL320_.jpg,Sponsored,"HP Probook 250 G8 15.6"" FHD Business Laptop Computer, Intel Core i5-1135G7 (Beat i7-1065G7), 16GB DDR4 RAM, 512GB PCIe SSD, 802.11AC WiFi, Bluetooth 5.0, Natural Silver, Windows 11 Pro, AZ-XUT",5.0,1.0,449.0,,
11,12.0,https://amazon.com/dp/B0CTQ5C2ZD,B0CTQ5C2ZD,https://m.media-amazon.com/images/I/71HS+BrQG7L._AC_UL320_.jpg,Sponsored,"15.6"" Laptop Computer,16GB RAM 512GB SSD, Intel Celeron Quad-Core N5095 Processor, Laptop Computers with FHD IPS 1920x1080 Display,2.4/5G WiFi, Bluetooth, Type-C, Mini HDMI, USB 3.0",4.7,31.0,219.99,1.0,100.0
12,13.0,https://amazon.com/dp/B0CNRBGMLQ,B0CNRBGMLQ,https://m.media-amazon.com/images/I/713adsTH6bL._AC_UL320_.jpg,Sponsored,"15.6"" Laptop Computer, 16GB RAM Laptop Computer, Intel Celeron N5095 Processors,1080P Display, USB 3.0, Bluetooth 4.2, Type-C, Mini-HDMI, 38000mWh Battery.",4.2,25.0,216.59,,
13,14.0,https://amazon.com/dp/B0CRDCXRK2,B0CRDCXRK2,https://m.media-amazon.com/images/I/81GrCeuCzxL._AC_UL320_.jpg,,"ASUS ROG Strix G16 (2024) Gaming Laptop, 16” 16:10 FHD 165Hz Display, NVIDIA® GeForce RTX™ 4060, Intel Core i7-13650HX, 16GB DDR5, 1TB PCIe Gen4 SSD, Wi-Fi 6E, Windows 11, G614JV-AS74",4.4,1081.0,1392.01,1.0,1000.0
14,15.0,https://amazon.com/dp/B0947BJ67M,B0947BJ67M,https://m.media-amazon.com/images/I/815uX7wkOZS._AC_UL320_.jpg,,"HP 14 Laptop, Intel Celeron N4020, 4 GB RAM, 64 GB Storage, 14-inch Micro-edge HD Display, Windows 11 Home, Thin & Portable, 4K Graphics, One Year of Microsoft 365 (14-dq0040nr, Snowflake White)",3.9,1340.0,185.49,,2000.0
15,16.0,https://amazon.com/dp/B0B2D77YB8,B0B2D77YB8,https://m.media-amazon.com/images/I/711OHeRmEaL._AC_UL320_.jpg,,"HP Newest 14"" Ultral Light Laptop for Students and Business, Intel Quad-Core N4120, 8GB RAM, 192GB Storage(64GB eMMC+128GB Micro SD), 1 Year Office 365, Webcam, HDMI, WiFi, USB-A&C, Win 11 S",4.1,540.0,249.98,0.0,2000.0
16,17.0,https://amazon.com/dp/B0CM5JV268,B0CM5JV268,https://m.media-amazon.com/images/I/61lsexTCOhL._AC_UL320_.jpg,,"Apple 2023 MacBook Pro Laptop M3 chip with 8‑core CPU, 10‑core GPU: 14.2-inch Liquid Retina XDR Display, 8GB Unified Memory, 512GB SSD Storage. Works with iPhone/iPad; Space Gray",4.6,230.0,1449.0,1.0,500.0
17,18.0,https://amazon.com/dp/B0CMRGBXM9,B0CMRGBXM9,https://m.media-amazon.com/images/I/71F-Wcriq4L._AC_UL320_.jpg,,"Acer Nitro V Gaming Laptop | Intel Core i7-13620H Processor | NVIDIA GeForce RTX 4050 Laptop GPU | 15.6"" FHD IPS 144Hz Display | 16GB DDR5 | 512GB Gen 4 SSD | WiFi 6 | Backlit KB | ANV15-51-73B9",4.1,56.0,960.0,4.0,1000.0
18,19.0,https://amazon.com/dp/B0CPGKT77T,B0CPGKT77T,https://m.media-amazon.com/images/I/71pTP-ll4sL._AC_UL320_.jpg,,"HP 15.6"" Portable Laptop (Include 1 Year Microsoft 365), HD Display, Intel Quad-Core N200 Processor, 16GB RAM, 128GB Storage, Wi-Fi 5, Webcam, HDMI, Numeric Keypad, Windows 11 Home, Red",4.2,387.0,293.0,7.0,1000.0
19,20.0,https://amazon.com/dp/B0CM5BL45N,B0CM5BL45N,https://m.media-amazon.com/images/I/618d5bS2lUL._AC_UL320_.jpg,,"Apple 2023 MacBook Pro Laptop M3 Pro chip with 12‑core CPU, 18‑core GPU: 16.2-inch Liquid Retina XDR Display, 18GB Unified Memory, 512GB SSD Storage. Works with iPhone/iPad; Space Black",4.6,170.0,2334.0,1.0,300.0
20,21.0,https://amazon.com/dp/B0751N2Y78,B0751N2Y78,https://m.media-amazon.com/images/I/61U4MibK9tL._AC_UL320_.jpg,,"2017 Apple Macbook Air with 1.8GHz Intel Core i5 (13-inch, 8GB RAM, 128GB SSD Storage) (QWERTY English) Silver (Renewed)",4.1,569.0,226.0,2.0,1000.0
21,22.0,https://amazon.com/dp/B0CP129FCR,B0CP129FCR,https://m.media-amazon.com/images/I/71FgRLpzwhL._AC_UL320_.jpg,,"hp Newest 15.6"" Anti-Glare HD Laptop, Intel Quad-core Processor, 16GB RAM, 128GB SSD+ 128GB JVQ USB Storage, Office 365 1-Year, Up to 11 hrs Long Battery, Win11 S, Scarlet Red",4.4,327.0,329.95,2.0,1000.0
22,23.0,https://amazon.com/dp/B0CC936WF1,B0CC936WF1,https://m.media-amazon.com/images/I/71gbrvRJI-L._AC_UL320_.jpg,,"Dell Inspiron 15 3000 3520 Business Laptop Computer[Windows 11 Pro], 15.6'' FHD Touchscreen, 11th Gen Intel Quad-Core i5-1135G7, 16GB RAM, 1TB PCIe SSD, Numeric Keypad, Wi-Fi, Webcam, HDMI, Black",4.1,60.0,509.0,2.0,500.0
23,24.0,https://amazon.com/dp/B0CFCJXF4D,B0CFCJXF4D,https://m.media-amazon.com/images/I/716RtGBuvyL._AC_UL320_.jpg,,"HP 2023 Newest Envy Laptop, 17.3"" FHD Touchscreen, 13th Gen Intel Core i7-13700H Processor, 64GB RAM, 2TB PCIe SSD, Webcam, HDMI, Backlit KB, SD Card Reader, Wi-Fi 6, Windows 11 Pro, Grey",4.3,84.0,1113.1,3.0,200.0
24,25.0,https://amazon.com/dp/B0CRD6PJDF,B0CRD6PJDF,https://m.media-amazon.com/images/I/71xZUkl5dyL._AC_UL320_.jpg,"$2,059.99","ASUS Zenbook Duo Laptop, Dual 14” OLED 3K 120Hz Touch Display, Intel Evo Certified, Intel Core Ultra 9 185H CPU, Intel Arc Graphics, 32GB RAM, 1TB SSD, Windows 11, Inkwell Gray, UX8406MA-PS99T",4.4,78.0,,,300.0
25,26.0,https://amazon.com/dp/B086MBQKH2,B086MBQKH2,https://m.media-amazon.com/images/I/61dsJm45m3L._AC_UL320_.jpg,,"Acer Chromebook Spin 311 Convertible Laptop, Intel Celeron N4020, 11.6"" HD Touch, 4GB LPDDR4, 32GB eMMC, Gigabit Wi-Fi 5, Bluetooth 5.0, Google Chrome, CP311-2H-C679",4.5,10116.0,204.39,1.0,1000.0
26,27.0,https://amazon.com/dp/B0CFRVSTGL,B0CFRVSTGL,https://m.media-amazon.com/images/I/71juF7A+MsL._AC_UL320_.jpg,,"HP Victus 15 Gaming Laptop, 15.6"" FHD 144Hz Display, AMD Ryzen 5 7535HS, 16GB DDR5 RAM, 1TB PCIe M.2 SSD, NVIDIA GeForce RTX 2050, HDMI, Webcam, Backlit Keyboard, Wi-Fi 6, Windows 11 Home, Silver",4.3,597.0,644.0,3.0,500.0
27,28.0,https://amazon.com/dp/B07TT9W26Z,B07TT9W26Z,https://m.media-amazon.com/images/I/61xm1J2DZzL._AC_UL320_.jpg,Sponsored,"Dell Inspiron 15 Laptop for Business and Students, 15.6 FHD Touchscreen Display, 12th Gen Intel Core i5-1235U, 32GB RAM, 2TB NVMe SSD, Webcam, SD Card Reader, Keypad, HDMI, SPS HDMI, Win 11 Pro",,,699.99,,
28,29.0,https://amazon.com/dp/B0CLY3T59M,B0CLY3T59M,https://m.media-amazon.com/images/I/71WS2+5OsUL._AC_UL320_.jpg,Sponsored,"Laptop Computer, 15.6"" Full HD 1080P Display, Intel Celeron N5095 Processors,16GB RAM, 512GB SSD,USB 3.0, Mini-HDMI, 2.4/5G WiFi",4.1,26.0,219.99,,
29,30.0,https://amazon.com/dp/B0CYC1L8TC,B0CYC1L8TC,https://m.media-amazon.com/images/I/71Aj9q94QeL._AC_UL320_.jpg,Sponsored,"Laptop Computer, 8GB Memory, 256GB SSD Storage, 15.6"" HD Display, Intel Celeron Quad-Core Processors, Mini HDMI, 2MP Webcam, Bluetooth, Type-C, TF Card",4.0,3.0,189.99,,
30,31.0,https://amazon.com/dp/B0CNTJH19L,B0CNTJH19L,https://m.media-amazon.com/images/I/61dOHhU8uGL._AC_UL320_.jpg,Sponsored,"HP Probook 250 G8 15.6"" FHD Business Laptop Computer, Intel Core i5-1135G7 (Beat i7-1065G7), 16GB DDR4 RAM, 512GB PCIe SSD, 802.11AC WiFi, Bluetooth 5.0, Natural Silver, Windows 11 Pro, AZ-XUT",5.0,1.0,449.0,,
31,32.0,https://amazon.com/dp/B0CT1ZFGPC,B0CT1ZFGPC,https://m.media-amazon.com/images/I/71+9WfLKBeL._AC_UL320_.jpg,Sponsored,"HP 17 Laptop for Business and Student, 17.3"" FHD Anti-Glare Display, Intel Core i3-N305(8-core), 16GB RAM, 512GB SSD, Wi-Fi 6, Fast Charge, Fingerprint Reader, Windows 11 Home, with Laptop Stand",5.0,1.0,449.99,2.0,
32,33.0,https://amazon.com/dp/B0CZDPPCPV,B0CZDPPCPV,https://m.media-amazon.com/images/I/71npaILaMYL._AC_UL320_.jpg,Sponsored,"Laptop Computer, 15.6"" FHD IPS 1920x1080 Screen, 16GB RAM, 512GB SSD, Intel Celeron Quad-Core Processors, WiFi, Bluetooth, Type-C, TF Card, Mini-HDMI, 2MP Webcam.",4.2,22.0,219.99,1.0,100.0
33,34.0,https://amazon.com/dp/B0C7MR5RDH,B0C7MR5RDH,https://m.media-amazon.com/images/I/51PsNbMd-CL._AC_UL320_.jpg,,"HP 2023 Newest Chromebook Laptop, 14 Inch Display, Intel Celeron N4120 Processor, 4GB RAM, 64GB eMMC, Intel UHD Graphics 600, WiFi, Bluetooth, Chrome OS, Modern Gray",4.2,251.0,192.99,2.0,1000.0
34,35.0,https://amazon.com/dp/B0CP8D4SM2,B0CP8D4SM2,https://m.media-amazon.com/images/I/71F-Wcriq4L._AC_UL320_.jpg,,"Acer Nitro V Gaming Laptop | Intel Core i5-13420H Processor | NVIDIA GeForce RTX 4050 Laptop GPU | 15.6"" FHD IPS 144Hz Display | 8GB DDR5 | 512GB Gen 4 SSD | WiFi 6 | Backlit KB | ANV15-51-51H9",4.5,4431.0,771.86,1.0,400.0
35,36.0,https://amazon.com/dp/B0CDQTSSTR,B0CDQTSSTR,https://m.media-amazon.com/images/I/61ZCdzmymsL._AC_UL320_.jpg,$30.00 coupon applied at checkout,"Lenovo IdeaPad 1 Student Laptop, Intel Dual Core Processor, 20GB RAM, 1TB SSD + 128GB eMMC, 15.6"" FHD Display, 1 Year Office 365, Windows 11 Home, Wi-Fi 6, Webcam, Bluetooth, SD Card Reader, Grey",4.2,431.0,389.0,,500.0
36,37.0,https://amazon.com/dp/B08PNQTYV2,B08PNQTYV2,https://m.media-amazon.com/images/I/71fMZDz2sEL._AC_UL320_.jpg,,"Late 2020 Apple MacBook Air with Apple M1 Chip (13.3 inch, 8GB RAM, 256GB SSD) Space Gray (Renewed)",4.4,1675.0,619.0,2.0,500.0
37,38.0,https://amazon.com/dp/B09VZR2BGN,B09VZR2BGN,https://m.media-amazon.com/images/I/61G9Yr3n6rL._AC_UL320_.jpg,,"Newest HP 14"" HD Laptop, Windows 11, Intel Celeron Dual-Core Processor Up to 2.60GHz, 4GB RAM, 64GB SSD, Webcam, Dale Pink(Renewed) (Dale Blue)",4.0,1237.0,156.99,1.0,1000.0
38,39.0,https://amazon.com/dp/B09Z111KTW,B09Z111KTW,https://m.media-amazon.com/images/I/51wUE2WiNrL._AC_UL320_.jpg,,"HP Newest 14"" HD Laptop, Windows 11, Intel Celeron Dual-Core Processor Up to 2.60GHz, 4GB RAM, 64GB SSD, Webcam(Renewed)",4.1,210.0,156.99,5.0,1000.0
39,40.0,https://amazon.com/dp/B0C4G4L53W,B0C4G4L53W,https://m.media-amazon.com/images/I/71aTEZOda0L._AC_UL320_.jpg,,"HP Newest Pavilion 15.6"" HD Touchscreen Anti-Glare Laptop, 16GB RAM, 1TB SSD Storage, Intel Core Processor up to 4.1GHz, Up to 11 Hours Long Battery Life, Type-C, HDMI, Windows 11 Home, Silver",4.2,492.0,420.0,2.0,500.0
40,41.0,https://amazon.com/dp/B0D26H58GL,B0D26H58GL,https://m.media-amazon.com/images/I/818CTxQVMHL._AC_UL320_.jpg,$100.00 coupon applied at checkout,Hp Everyday Essential 17 FHD Laptop • Free Microsoft Office Suite Included • 32GB RAM • 1.5TB SSD(1TB PCIe & P500 500GB External) • Intel 8-core i3 Processor • HDMI • Long Battery Life • Windows 11,4.4,69.0,699.99,,400.0
41,42.0,https://amazon.com/dp/B0CG7NVGQ2,B0CG7NVGQ2,https://m.media-amazon.com/images/I/81vnNsRDo6L._AC_UL320_.jpg,,"MSI Katana 17 Gaming Laptop: 13th Gen Intel Core i7, GeForce RTX 4060, 17.3"" 144Hz FHD Display, 32GB DDR5, 1TB NVMe SSD, USB-Type C, Cooler Boost 5, Win11 Home: Black B13VFK-835US",4.3,423.0,1399.0,1.0,300.0
42,43.0,https://amazon.com/dp/B0CK9JSM3G,B0CK9JSM3G,https://m.media-amazon.com/images/I/71aoL3LtkrL._AC_UL320_.jpg,,"Lenovo V15 Laptop, 15.6"" FHD Display, AMD Ryzen 5 5500U Hexa-core Processor (Beat Intel i7-1065G7), 16GB RAM, 512GB SSD, HDMI, RJ45, Numeric Keypad, Wi-Fi, Windows 11 Pro, Black",4.4,271.0,489.0,7.0,500.0
43,44.0,https://amazon.com/dp/B0D2QP5RCY,B0D2QP5RCY,https://m.media-amazon.com/images/I/81AyiuB2WwL._AC_UL320_.jpg,$100.00 coupon applied at checkout,"Lenovo Newest 15.6"" Laptop, 16GB RAM, 1TB SSD Storage, 15.6"" FHD (1920 x 1080) Display, Ethernet Port, HDMI, USB-C, WiFi & Bluetooth, Intel Dual-core Processor, Windows 11 Home",4.4,161.0,499.99,,400.0
44,45.0,https://amazon.com/dp/B09X9P4TH6,B09X9P4TH6,https://m.media-amazon.com/images/I/41dxmvxO3jL._AC_UL320_.jpg,Sponsored,"HP Chromebook 11 G7 EE 11.6"" Laptop, Intel Celeron N4000, 4GB RAM, 16GB eMMC SSD (6QY22UT#ABA) (Renewed)",3.9,83.0,67.99,,
45,46.0,https://amazon.com/dp/B0D1NMCTH8,B0D1NMCTH8,https://m.media-amazon.com/images/I/6106uXmjnTL._AC_UL320_.jpg,Sponsored,"HP 15 Laptop for Business and Student, with Microsoft Office 2021 Lifetime License,15.6"" HD Touchscreen Display,Intel 12th i3-1215U (6 Cores),Webcam, (Windows 11 Home, 32GB RAM | 1TB PCIe SSD)",,,559.0,,
46,47.0,https://amazon.com/dp/B0CQJ7LVYD,B0CQJ7LVYD,https://m.media-amazon.com/images/I/71uBnizn02L._AC_UL320_.jpg,Sponsored,"Laptop Computer 14.1Inch Laptop 8GB RAM 512GB SSD, IPS1080PLaptop, Intel Quad-Core(Up to 2.7GHz) J4125 Processor Windows 11 Pro Laptop, HD Camera, Dual Frequency WiFi(2.4G/5G)",4.4,13.0,229.99,,
47,48.0,https://amazon.com/dp/B0CRDF25TQ,B0CRDF25TQ,https://m.media-amazon.com/images/I/81kxce-AlLL._AC_UL320_.jpg,,"ASUS TUF Gaming A15 (2024) Gaming Laptop, 15.6” FHD 144Hz Display, NVIDIA® GeForce RTX™ 2050, AMD Ryzen™ 5 7535HS, 8GB DDR5, 512GB PCIe® Gen4 NVMe™ SSD, Wi-Fi 6, Windows 11, FA506NF-ES51",4.4,493.0,699.99,1.0,400.0
48,49.0,https://amazon.com/dp/B0BTZWF5G2,B0BTZWF5G2,https://m.media-amazon.com/images/I/61QzVOkMSKL._AC_UL320_.jpg,,"ASUS TUF Gaming F15 (2022) Gaming Laptop, 15.6” FHD 144Hz Display, GeForce RTX 3050, Intel Core i5-12500H, 16GB DDR4, 512GB PCIe SSD, Wi-Fi 6, Windows 11, FX507ZC-ES53,Mecha Gray",4.3,230.0,699.99,1.0,500.0
49,50.0,https://amazon.com/dp/B0CJB5N9BQ,B0CJB5N9BQ,https://m.media-amazon.com/images/I/51h3oOo7XnL._AC_UL320_.jpg,,"Lenovo IdeaPad 1 Laptop, 15.6” FHD Display, AMD Ryzen 5 5500U, 8GB RAM, 512GB SSD, Windows 11 Home, 720p Camera w/Privacy Shutter, Smart Noise Cancelling, Cloud Grey",4.4,191.0,329.99,1.0,500.0
50,51.0,https://amazon.com/dp/B08PPZMDPK,B08PPZMDPK,https://m.media-amazon.com/images/I/61wXxWPCSQL._AC_UL320_.jpg,,"2020 Apple MacBook Pro with Apple M1 Chip (13-inch, 8GB RAM, 256GB SSD Storage) Space Gray (Renewed)",4.5,519.0,660.0,7.0,400.0
51,52.0,https://amazon.com/dp/B07G29RCBD,B07G29RCBD,https://m.media-amazon.com/images/I/71NZpTxWzRL._AC_UL320_.jpg,,Apple MacBook Pro 13.3in Retina Laptop Intel i5 Dual Core 2.6GHz 8GB 128GB SSD - MGX72LL/A (Renewed),4.0,921.0,279.0,2.0,500.0
52,53.0,https://amazon.com/dp/B0CZL2SLCJ,B0CZL2SLCJ,https://m.media-amazon.com/images/I/61QuxlKVZbL._AC_UL320_.jpg,,"HP Stream 14"" HD BrightView Laptop, Intel Celeron N4120, 16GB RAM, 288GB Storage (128GB Emmc+ 160GB Docking Station Set), Intel UHD Graphics, 720p Webcam, Wi-Fi, 1 Year Office 365, Win 11 S, Gold",4.4,1770.0,299.0,1.0,500.0
53,54.0,https://amazon.com/dp/B0CRDCFNHW,B0CRDCFNHW,https://m.media-amazon.com/images/I/61FYc36J93L._AC_UL320_.jpg,,"ASUS Vivobook 15.6” FHD Laptop, AMD Ryzen 3 3250U, 8GB RAM, 128GB SSD, Windows 11 Home in S Mode, Transparent Silver, M515DA-WS33",4.0,79.0,332.99,1.0,500.0
54,55.0,https://amazon.com/dp/B0BRT67MWZ,B0BRT67MWZ,https://m.media-amazon.com/images/I/719yYrijeKL._AC_UL320_.jpg,,"Dell Inspiron 3511 Laptop, 15.6"" Full HD Touchscreen, Intel Core i5-1135G7 (Beats Intel i7-1065G7), 32GB DDR4 RAM, 1TB PCIe SSD, SD Card Reader, HDMI, Wi-Fi, Windows 11 Home, Black",4.0,455.0,539.0,2.0,500.0
55,56.0,https://amazon.com/dp/B0BQ9W4DV3,B0BQ9W4DV3,https://m.media-amazon.com/images/I/712VAsKBk-L._AC_UL320_.jpg,,"HP 2023 15'' HD IPS Laptop, Windows 11, Intel Pentium 4-Core Processor Up to 2.70GHz, 8GB RAM, 128GB SSD, HDMI, Super-Fast 6th Gen WiFi, Dale Red (Renewed)",4.3,676.0,214.99,3.0,500.0
56,57.0,https://amazon.com/dp/B0BSP51S36,B0BSP51S36,https://m.media-amazon.com/images/I/71DL+S6ihBL._AC_UL320_.jpg,,"ASUS C424MA-AS48F Chromebook C424, 14.0"" 180 Degree FHD NanoEdge Display, Intel Dual Core Celeron Processor, 4GB LPDDR4 RAM, 128GB Storage, Silver Color, C424MA-AS48F",4.2,301.0,199.99,0.0,500.0
57,58.0,https://amazon.com/dp/B082P8N4KJ,B082P8N4KJ,https://m.media-amazon.com/images/I/61cEe0sO6JL._AC_UL320_.jpg,,"Late 2019 Apple MacBook Pro with 2.6GHz Intel Core i7 (16 inch, 16GB RAM, 512GB) Space Gray (Renewed)",4.2,771.0,634.99,1.0,400.0
58,59.0,https://amazon.com/dp/B0CRCYJ8YV,B0CRCYJ8YV,https://m.media-amazon.com/images/I/71kOH3in8TL._AC_UL320_.jpg,,"ASUS ROG Strix G16 (2024) Gaming Laptop, 16” Nebula Display 16:10 QHD 240Hz, GeForce RTX 4060, Intel® Core™ i9-14900HX, 16GB DDR5-5600, 1TB PCIe SSD, Wi-Fi 6E, Windows 11, G614JVR-ES94",4.3,97.0,1668.01,1.0,200.0
59,60.0,https://amazon.com/dp/B0D1HLTF5L,B0D1HLTF5L,https://m.media-amazon.com/images/I/41wJ1zfNSBL._AC_UL320_.jpg,Sponsored,"HP 15 Laptop Computer for Business & Student 15.6"" FHD Display, with Microsoft Office 2021 Lifetime License, AMD Ryzen 5-7520U, Webcam, WiFi 6, Type-C (Win 11 Pro, 16GB RAM | 512GB PCIe SSD)",,,489.0,,
60,61.0,https://amazon.com/dp/B07TT9W26Z,B07TT9W26Z,https://m.media-amazon.com/images/I/61xm1J2DZzL._AC_UL320_.jpg,Sponsored,"Dell Inspiron 15 Laptop for Business and Students, 15.6 FHD Touchscreen Display, 12th Gen Intel Core i5-1235U, 32GB RAM, 2TB NVMe SSD, Webcam, SD Card Reader, Keypad, HDMI, SPS HDMI, Win 11 Pro",,,699.99,,
61,62.0,https://amazon.com/dp/B0D178MKZ1,B0D178MKZ1,https://m.media-amazon.com/images/I/71ILCEwR+-L._AC_UL320_.jpg,Sponsored,"14'' Laptop 8GB DDR4 512GB SSD, Celeron N4000 Processors Laptop Computer, Windows 11 IPS FHD Display Laptop Computer,Numeric Keypad USB 3.0, Bluetooth 4.2, 2.4/5G WiFi",,,189.0,,
62,63.0,https://amazon.com/dp/B0CNTJH19L,B0CNTJH19L,https://m.media-amazon.com/images/I/61dOHhU8uGL._AC_UL320_.jpg,Sponsored,"HP Probook 250 G8 15.6"" FHD Business Laptop Computer, Intel Core i5-1135G7 (Beat i7-1065G7), 16GB DDR4 RAM, 512GB PCIe SSD, 802.11AC WiFi, Bluetooth 5.0, Natural Silver, Windows 11 Pro, AZ-XUT",5.0,1.0,449.0,,
63,64.0,https://amazon.com/dp/B0CT1ZFGPC,B0CT1ZFGPC,https://m.media-amazon.com/images/I/71+9WfLKBeL._AC_UL320_.jpg,Sponsored,"HP 17 Laptop for Business and Student, 17.3"" FHD Anti-Glare Display, Intel Core i3-N305(8-core), 16GB RAM, 512GB SSD, Wi-Fi 6, Fast Charge, Fingerprint Reader, Windows 11 Home, with Laptop Stand",5.0,1.0,449.99,2.0,
64,65.0,https://amazon.com/dp/B09X9P4TH6,B09X9P4TH6,https://m.media-amazon.com/images/I/41dxmvxO3jL._AC_UL320_.jpg,Sponsored,"HP Chromebook 11 G7 EE 11.6"" Laptop, Intel Celeron N4000, 4GB RAM, 16GB eMMC SSD (6QY22UT#ABA) (Renewed)",3.9,83.0,67.99,,
65,66.0,https://amazon.com/dp/B0BT3CD75G,B0BT3CD75G,https://m.media-amazon.com/images/I/71JqyTBiXrL._AC_UL320_.jpg,,"MSI Thin GF63 15.6"" 144Hz Gaming Laptop: 12th Gen Intel Core i7, NVIDIA GeForce RTX 4050, 16GB DDR4, 512GB NVMe SSD, Type-C, Cooler Boost 5, Win11 Home: Black 12VE-066US",4.4,2532.0,889.0,1.0,300.0
66,67.0,https://amazon.com/dp/B0CS1D8B1R,B0CS1D8B1R,https://m.media-amazon.com/images/I/61bIauyrn7L._AC_UL320_.jpg,,"HP Portable 13.8"" HD IPS Laptop, Intel Celeron N Processor Up to 2.78GHz, 4GB DDR4, 64GB SSD, HDMI, RJ45, Webcam, Bluetooth, Windows 11, Pastel Pink(Renewed)",4.3,50.0,156.99,1.0,500.0
67,68.0,https://amazon.com/dp/B0CYPZ2FL6,B0CYPZ2FL6,https://m.media-amazon.com/images/I/71zQFoKg2ZL._AC_UL320_.jpg,,"jumper Laptop, 16 Inch FHD IPS 16:10 Screen, Intel Celeron Quad Core CPU, 4GB LPDDR4 RAM 128GB Storage, Office 365 1-Year Subscription.",3.1,14.0,,,500.0
68,69.0,https://amazon.com/dp/B09RNC69K8,B09RNC69K8,https://m.media-amazon.com/images/I/71Tp0GOd33L._AC_UL320_.jpg,,"Lenovo - 2022 - IdeaPad 3i - Essential Laptop Computer - Intel Core i5 - 15.6"" FHD Display - 8GB Memory - 512GB Storage - Windows 11 Pro",4.5,569.0,399.99,1.0,400.0
69,70.0,https://amazon.com/dp/B0BYBKZ7XD,B0BYBKZ7XD,https://m.media-amazon.com/images/I/71sxwp5iwjL._AC_UL320_.jpg,,"Lenovo ThinkPad E14 Gen 5 Business Laptop, 14"" FHD+ Display, AMD Ryzen 7 7730U (Beat i7-1255U), 16GB RAM, 512GB SSD, FP Reader, Backlit Keyboard, HDMI, RJ45, Wi-Fi 6, Windows 11 Pro, Black",4.6,49.0,779.0,1.0,300.0
70,71.0,https://amazon.com/dp/B0BTQWR77M,B0BTQWR77M,https://m.media-amazon.com/images/I/71iZrF8XXiL._AC_UL320_.jpg,,"Acer Swift Go Intel Evo Thin & Light Premium Laptop 14"" 1920x1200 100% sRGB Touch Screen Display Intel Core i7-1355U Intel Iris Xe 16GB LPDDR5 512GB Gen 4 SSD SFG14-71T-72QV",4.3,200.0,575.0,1.0,500.0
71,72.0,https://amazon.com/dp/B07J3RG68L,B07J3RG68L,https://m.media-amazon.com/images/I/61o62q+1GUL._AC_UL320_.jpg,,"Apple MacBook Pro 13-inch 2.3GHz Core i5, 256GB - Space Gray - 2017 (Renewed)",3.9,2721.0,339.0,2.0,400.0
72,73.0,https://amazon.com/dp/B0CT98X2CV,B0CT98X2CV,https://m.media-amazon.com/images/I/71ZLMvmPSrL._AC_UL320_.jpg,,"HP Newest 15.6"" FHD Essential Business Laptop, Intel Core i5-1135G7 Processor, 32GB RAM, 1TB Storage, Intel Iris Xe Graphics, SD Card Reader, HDMI, Ethernet, Webcam, USB-C, Windows 11 Pro",4.1,16.0,599.0,2.0,300.0
73,74.0,https://amazon.com/dp/B0BSHDJG9T,B0BSHDJG9T,https://m.media-amazon.com/images/I/61fd2oCrvyL._AC_UL320_.jpg,,"Apple 2023 MacBook Pro Laptop M2 Pro chip with 12‑core CPU and 19‑core GPU: 16.2-inch Liquid Retina XDR Display, 16GB Unified Memory, 512GB SSD Storage. Works with iPhone/iPad; Space Gray",4.7,360.0,1998.99,1.0,200.0
74,75.0,https://amazon.com/dp/B0D2HHTSHY,B0D2HHTSHY,https://m.media-amazon.com/images/I/71THjdzBUtL._AC_UL320_.jpg,,"AOC Laptop Computer 15.6 Inch FHD Screen Premium Laptop with N97 Processor(Up to 3.6GHz) Gaming Laptops 16GB RAM 512GB SSD, Windows 11 Laptop Computer, Light&Thin, Metal Shell, Webcam, Type-C, USB3.2",5.0,4.0,379.99,2.0,300.0
75,76.0,https://amazon.com/dp/B0CPKS65P5,B0CPKS65P5,https://m.media-amazon.com/images/I/61IpRGnny7L._AC_UL320_.jpg,,"HP Portable Laptop, Student and Business, 14"" HD Display, Intel Quad-Core N4120, 16GB DDR4 RAM, 64GB eMMC, 1 Year Office 365, Webcam, RJ-45, HDMI, Wi-Fi, Windows 11 Home, Silver",4.2,945.0,229.0,1.0,500.0
76,77.0,https://amazon.com/dp/B0CKN6R3X7,B0CKN6R3X7,https://m.media-amazon.com/images/I/61hmSH8an5L._AC_UL320_.jpg,,"Dell Chromebook 3180 Laptop Computer, 11.6 Inch Laptop PC, Intel Celeron N3060, 4GB RAM, 16GB SSD, Web Camera, Wi-Fi, Bluetooth, HDMI, Chrome OS (Renewed)",3.8,202.0,52.0,3.0,1000.0
77,78.0,https://amazon.com/dp/B0CQJ7LVYD,B0CQJ7LVYD,https://m.media-amazon.com/images/I/71uBnizn02L._AC_UL320_.jpg,Sponsored,"Laptop Computer 14.1Inch Laptop 8GB RAM 512GB SSD, IPS1080PLaptop, Intel Quad-Core(Up to 2.7GHz) J4125 Processor Windows 11 Pro Laptop, HD Camera, Dual Frequency WiFi(2.4G/5G)",4.4,13.0,229.99,,
78,79.0,https://amazon.com/dp/B0CZDPPCPV,B0CZDPPCPV,https://m.media-amazon.com/images/I/71npaILaMYL._AC_UL320_.jpg,Sponsored,"Laptop Computer, 15.6"" FHD IPS 1920x1080 Screen, 16GB RAM, 512GB SSD, Intel Celeron Quad-Core Processors, WiFi, Bluetooth, Type-C, TF Card, Mini-HDMI, 2MP Webcam.",4.2,22.0,219.99,1.0,100.0
79,80.0,https://amazon.com/dp/B0D1NMCTH8,B0D1NMCTH8,https://m.media-amazon.com/images/I/6106uXmjnTL._AC_UL320_.jpg,Sponsored,"HP 15 Laptop for Business and Student, with Microsoft Office 2021 Lifetime License,15.6"" HD Touchscreen Display,Intel 12th i3-1215U (6 Cores),Webcam, (Windows 11 Home, 32GB RAM | 1TB PCIe SSD)",,,559.0,,
80,81.0,https://amazon.com/dp/B0BZXZSG4J,B0BZXZSG4J,https://m.media-amazon.com/images/I/51mlifq5qmL._AC_UL320_.jpg,,"Lenovo IdeaPad 1 15.6"" FHD Laptop Newest, Intel Pentium Silver N6000, 12GB RAM, 256GB PCIe SSD+128GB eMMC, 1 Year Microsoft Office 365, Webcam, Type-C, SD Card Reader, Wi-Fi 6, Windows 11",4.3,156.0,279.0,1.0,500.0
